sno,song,lyrics,album,Unnamed: 4,Unnamed: 5
1,Lose Yourself,"Look, if you had one shot, or one opportunity|-|To seize everything you ever wanted, in one moment|-|Would you capture it, or just let it slip?|-||-|Yo! His palms are sweaty, knees weak, arms are heavy|-|There's vomit on his sweater already: Mom's spaghetti|-|He's nervous, but on the surface he looks calm and ready|-|To drop bombs, but he keeps on forgetting|-|What he wrote down, the whole crowd goes so loud|-|He opens his mouth, but the words won't come out|-|He's choking, how? Everybody's joking now|-|The clock's run out, time's up, over, blaow!|-|Snap back to reality, ope there goes gravity, ope|-|There goes Rabbit, he choked, he's so mad but he won't|-|Give up that easy, no, he won't have it, he knows|-|His whole back's to these ropes, it don't matter, he's dope|-|He knows that but he's broke, he's so stagnant, he knows|-|When he goes back to this mobile home, that's when it's|-|Back to the lab again yo, this whole rhapsody|-|Better go capture this moment and hope it don't pass him, and|-||-|You better lose yourself in the music|-|The moment, you own it, you better never let it go|-|You only get one shot, do not miss your chance to blow|-|This opportunity comes once in a lifetime, yo|-|You better lose yourself in the music|-|The moment, you own it, you better never let it go|-|You only get one shot, do not miss your chance to blow|-|This opportunity comes once in a lifetime, yo|-|You better...|-||-|His soul's escaping through this hole that is gaping|-|This world is mine for the taking, make me king|-|As we move toward a New World Order|-|A normal life is boring; but superstardom's|-|Close to post-mortem, it only grows harder|-|Homie grows hotter, he blows, it's all over|-|These hoes is all on him, coast-to-coast shows|-|He's known as the Globetrotter, lonely roads|-|God only knows, he's grown farther from home, he's no father|-|He goes home and barely knows his own daughter|-|But hold your nose, 'cause here goes the cold water|-|These hoes don't want him no mo', he's cold product|-|They moved on to the next schmoe who flows|-|He nose-dove and sold nada, and so the soap opera|-|Is told, it unfolds, I suppose it's old, partner|-|But the beat goes on: da da dum da dum da da da da|-||-|You better lose yourself in the music|-|The moment, you own it, you better never let it go|-|You only get one shot, do not miss your chance to blow|-|This opportunity comes once in a lifetime, yo|-|You better lose yourself in the music|-|The moment, you own it, you better never let it go|-|You only get one shot, do not miss your chance to blow|-|This opportunity comes once in a lifetime, yo|-|You better...|-||-|No more games, I'ma change what you call rage|-|Tear this motherfuckin' roof off like two dogs caged|-|I was playin' in the beginning, the mood all changed|-|I've been chewed up and spit out and booed off stage|-|But I kept rhymin' and stepped right in the next cypher|-|Best believe somebody's payin' the Pied Piper|-|All the pain inside amplified by the|-|Fact that I can't get by with my 9-to-5|-|And I can't provide the right type of life for my family|-|'Cause man, these goddamn food stamps don't buy diapers|-|And there's no movie, there's no Mekhi Phifer, this is my life|-|And these times are so hard, and it's gettin' even harder|-|Tryna feed and water my seed, plus teeter-totter|-|Caught up between bein' a father and a prima donna|-|Baby mama drama, screamin' on her, too much for me to wanna|-|Stay in one spot, another day of monotony's|-|Gotten me to the point I'm like a snail, I've got|-|To formulate a plot or end up in jail or shot|-|Success is my only motherfuckin' option, failure's not|-|Mom, I love you, but this trailer's got|-|To go; I cannot grow old in Salem's Lot|-|So here I go, it's my shot: feet, fail me not|-|This may be the only opportunity that I got|-||-|You better lose yourself in the music|-|The moment, you own it, you better never let it go (go)|-|You only get one shot, do not miss your chance to blow|-|This opportunity comes once in a lifetime, yo|-|You better lose yourself in the music|-|The moment, you own it, you better never let it go (go)|-|You only get one shot, do not miss your chance to blow|-|This opportunity comes once in a lifetime, yo|-|You better...|-||-|You can do anything you set your mind to, man",,,
2,Stan,"My tea's gone cold I'm wondering why I got out of bed at all|-|The morning rain clouds up my window and I can't see at all|-|And even if I could it'd all be gray, but your picture on my wall|-|It reminds me, that it's not so bad, it's not so bad|-|My tea's gone cold I'm wondering why I got out of bed at all|-|The morning rain clouds up my window and I can't see at all|-|And even if I could it'd all be gray, but your picture on my wall|-|It reminds me, that it's not so bad, it's not so bad|-||-||-|Dear Slim, I wrote you but you still ain't calling|-|I left my cell, my pager, and my home phone at the bottom|-|I sent two letters back in autumn, you must not've got 'em|-|There probably was a problem at the post office or something|-|Sometimes I scribble addresses too sloppy when I jot 'em|-|But anyways; fuck it, what's been up? Man, how's your daughter?|-|My girlfriend's pregnant, too, I'm bout to be a father|-|If I have a daughter, guess what I'mma call her?|-|I'mma name her Bonnie|-|I read about your Uncle Ronnie, too, I'm sorry|-|I had a friend kill himself over some bitch who didn't want him|-|I know you probably hear this everyday, but I'm your biggest fan|-|I even got the underground shit that you did with Skam|-|I got a room full of your posters and your pictures, man|-|I like the shit you did with Rawkus, too, that shit was phat|-|Anyways, I hope you get this, man, hit me back|-|Just to chat, truly yours, your biggest fan|-|This is Stan|-||-|My tea's gone cold I'm wondering why I got out of bed at all|-|The morning rain clouds up my window and I can't see at all|-|And even if I could it'd all be gray, but your picture on my wall|-|It reminds me, that it's not so bad, it's not so bad|-||-|Dear Slim, you still ain't called or wrote, I hope you have a chance|-|I ain't mad - I just think it's FUCKED UP you don't answer fans|-|If you didn't wanna talk to me outside your concert|-|You didn't have to, but you coulda signed an autograph for Matthew|-|That's my little brother man, he's only six years old|-|We waited in the blistering cold for you|-|For four hours and you just said, ""No""|-|That's pretty shitty man - you're like his fucking idol|-|He wants to be just like you man, he likes you more than I do|-|I ain't that mad though, I just don't like being lied to|-|Remember when we met in Denver - you said if I'd write you|-|You would write back - see I'm just like you in a way|-|I never knew my father neither|-|He used to always cheat on my mom and beat her|-|I can relate to what you're saying in your songs|-|So when I have a shitty day, I drift away and put 'em on|-|'Cause I don't really got shit else so that shit helps when I'm depressed|-|I even got a tattoo of your name across the chest|-|Sometimes I even cut myself to see how much it bleeds|-|It's like adrenaline, the pain is such a sudden rush for me|-|See everything you say is real, and I respect you 'cause you tell it|-|My girlfriend's jealous 'cause I talk about you 24/7|-|But she don't know you like I know you Slim, no one does|-|She don't know what it was like for people like us growing up|-|You gotta call me man, I'll be the biggest fan you'll ever lose|-|Sincerely yours, Stan|-|P.S.|-|We should be together, too|-||-|My tea's gone cold I'm wondering why I got out of bed at all|-|The morning rain clouds up my window and I can't see at all|-|And even if I could it'd all be gray, but your picture on my wall|-|It reminds me, that it's not so bad, it's not so bad|-||-|Dear Mister I'm-Too-Good-To-Call-Or-Write-My-Fans,|-|This'll be the last package I ever send your ass|-|It's been six months and still no word. I don't deserve it?|-|I know you got my last two letters;|-|I wrote the addresses on 'em perfect|-|So this is my cassette I'm sending you, I hope you hear it|-|I'm in the car right now, I'm doing 90 on the freeway|-|Hey Slim, I drank a fifth of vodka, you dare me to drive?|-|You know the song by Phil Collins ""In the Air of the Night""|-|About that guy who coulda saved that other guy from drowning|-|But didn't, then Phil saw it all, then at a show he found him?|-|That's kinda how this is, you coulda rescued me from drowning|-|Now it's too late. I'm on a 1000 downers now, I'm drowsy|-|And all I wanted was a lousy letter or a call|-|I hope you know I ripped all of your pictures off the wall|-|I loved you, Slim, we coulda been together, think about it|-|You ruined it now, I hope you can't sleep and you dream about it|-|And when you dream I hope you can't sleep and you scream about it|-|I hope your conscience eats at you and you can't breathe without me|-|See, Slim,--shut up bitch! I'm trying to talk!|-|Hey, Slim, that's my girlfriend screaming in the trunk,|-|But I didn't slit her throat, I just tied her up. See, I ain't like you|-|'Cause if she suffocates she'll suffer more, and then she'll die, too|-|Well, gotta go, I'm almost at the bridge now|-|Oh shit, I forgot, how am I supposed to send this shit out?|-||-|My tea's gone cold I'm wondering why I got out of bed at all|-|The morning rain clouds up my window and I can't see at all|-|And even if I could it'd all be gray, but your picture on my wall|-|It reminds me, that it's not so bad, it's not so bad|-||-|Dear Stan, I meant to write you sooner but I've just been busy|-|You said your girlfriend's pregnant now, how far along is she?|-|Look, I'm really flattered you would call your daughter that|-|And here's an autograph for your brother|-|I wrote it on the Starter cap|-|I'm sorry I didn't see you at the show, I musta missed you|-|Don't think I did that shit intentionally just to diss you|-|But what's this shit you said about you like to cut your wrists, too?|-|I say that shit's just clowning , dawg|-|C'mon! How fucked up is you?|-|You got some issues, Stan, I think you need some counseling|-|To help your ass from bouncing off the walls when you get down some|-|And what's this shit about us meant to be together?|-|That type of shit'll make me not want us to meet each other|-|I really think you and your girlfriend need each other|-|Or maybe you just need to treat her better|-|I hope you get to read this letter, I just hope it reaches you in time|-|Before you hurt yourself, I think that you'll be doing just fine|-|If you relax a little, I'm glad I inspire you but, Stan|-|Why are you so mad? Try to understand, that I do want you as a fan|-|I just don't want you to do some crazy shit|-|I seen this one shit on the news a couple weeks ago that made me sick|-|Some dude was drunk and drove his car over a bridge|-|And had his girlfriend in the trunk, and she was pregnant with his kid|-|And in the car they found a tape, but they didn't say who it was to|-|Come to think about it, his name was... it was you|-|Damn!",,,
3,The Way I Am,"Whatever...|-|Dre, just let it run|-|Aiyyo turn the beat up a little bit|-|Aiyyo... this song is for anyone... fuck it|-|Just shut up and listen, aiyyo...|-||-|I sit back with this pack of Zig Zags and this bag|-|Of this weed it gives me the shit needed to be|-|The most meanest MC on this - on this Earth|-|And since birth I've been cursed with this curse to just curse|-|And just blurt this berserk and bizarre shit that works|-|And it sells and it helps in itself to relieve|-|All this tension dispensing these sentences|-|Getting this stress that's been eating me recently off of this chest|-|And I rest again peacefully (peacefully)...|-|But at least have the decency in you|-|To leave me alone, when you freaks see me out|-|In the streets when I'm eating or feeding my daughter|-|Do not come and speak to me (speak to me)...|-|I don't know you and no,|-|I don't owe you a motherfucking thing|-|I'm not Mr. N'Sync, I'm not what your friends think|-|I'm not Mr. Friendly, I can be a prick|-|If you tempt me my tank is on empty (is on empty)...|-|No patience is in me and if you offend me|-|I'm lifting you 10 feet (lifting you 10 feet)... in the air|-|I don't care who was there and who saw me just jaw you|-|Go call you a lawyer, file you a lawsuit|-|I'll smile in the courtroom and buy you a wardrobe|-|I'm tired of all you (of all you)...|-|I don't mean to be mean, but that's all I can be it's just me|-||-|And I am, whatever you say I am|-|If I wasn't, then why would I say I am?|-|In the paper, the news everyday I am|-|Radio won't even play my jam|-|'Cause I am, whatever you say I am|-|If I wasn't, then why would I say I am?|-|In the paper, the news everyday I am|-|I don't know, it's just the way I am|-||-|Sometimes I just feel like my father,|-|I hate to be bothered|-|With all of this nonsense it's constant|-|And, ""Oh, it's his lyrical content -|-|- the song 'Guilty Conscience' has gotten such rotten responses""|-|And all of this controversy circles me|-|And it seems like the media immediately|-|Points a finger at me (finger at me)...|-|So I point one back at 'em, but not the index or pinkie|-|Or the ring or the thumb, it's the one you put up|-|When you don't give a fuck, when you won't just put up|-|With the bullshit they pull, 'cause they full of shit too|-|When a dude's getting bullied and shoots up his school|-|And they blame it on Marilyn (on Marilyn)... and the heroin|-|Where were the parents at? And look where it's at|-|Middle America, now it's a tragedy|-|Now it's so sad to see, an upper class city|-|Having this happening (this happening)...|-|Then attack Eminem 'cause I rap this way (rap this way)...|-|But I'm glad 'cause they feed me the fuel that I need for the fire|-|To burn and it's burning and I have returned|-||-|And I am, whatever you say I am|-|If I wasn't, then why would I say I am?|-|In the paper, the news everyday I am|-|Radio won't even play my jam|-|'Cause I am, whatever you say I am|-|If I wasn't, then why would I say I am?|-|In the paper, the news everyday I am|-|I don't know it's just the way I am|-||-|I'm so sick and tired of being admired|-|That I wish that I would just die or get fired|-|And dropped from my label, let's stop with the fables|-|I'm not gonna be able to top on ""My Name is... ""|-|And pigeon-holed into some pop-py sensation|-|That got me rotation at rock'n'roll stations|-|And I just do not got the patience (got the patience)...|-|To deal with these cocky Caucasians who think|-|I'm some wigger who just tries to be black 'cause I talk|-|With an accent, and grab on my balls, so they always keep asking|-|The same fucking questions (fucking questions)...|-|What school did I go to, what hood I grew up in|-|The why, the who what when, the where, and the how|-|'Til I'm grabbing my hair and I'm tearing it out|-|'Cause they driving me crazy (driving me crazy)... I can't take it|-|I'm racing, I'm pacing, I stand and I sit|-|And I'm thankful for every fan that I get|-|But I can't take a shit, in the bathroom|-|Without someone standing by it|-|No, I won't sign your autograph|-|You can call me an asshole I'm glad|-||-|'Cause I am, whatever you say I am|-|If I wasn't, then why would I say I am?|-|In the paper, the news everyday I am|-|Radio won't even play my jam|-|'Cause I am, whatever you say I am|-|If I wasn't, then why would I say I am?|-|In the paper, the news everyday I am|-|I don't know, it's just the way I am",,,
4,Just Don't Give A fuck,"Whoa!|-|A get your hands in the air, and get to clapping 'em|-|And like, back and forth because ah|-|This is what you thought it wasn't|-|It beez the brothers representin' the Dirty Dozen|-|I be the F-R-O the double G And check out the man he goes by the name of er...|-||-|Slim Shady, brain dead like Jim Brady|-|I'm a M80, you Lil' like that Kim lady|-|I'm buzzing, Dirty Dozen, naughty rotten rhymer|-|Cursing at you players worse than Marty Schottenheimer|-|You wacker than the motherfucker you bit your style from|-|You ain't gonna sell two copies if you press a double album|-|Admit it, fuck it, while we coming out in the open|-|I'm doing acid, crack, smack, coke and smoking dope then|-|My name is Marshall Mathers, I'm an alcoholic (Hi Marshall)|-|I have a disease and they don't know what to call it|-|Better hide your wallet 'cause I'm coming up quick to strip your cash|-|Bought a ticket to your concert just to come and whip your ass|-|Bitch, I'm coming out swinging, so fast it'll make your eyes spin|-|You getting knocked the fuck out like Mike Tyson|-|The +Proof+ is in the pudding, just ask the Deshaun Holton|-|I'll slit your motherfucking throat worse than Ron Goldman|-||-|So when you see me on your block with two glocks|-|Screaming ""Fuck the World"" like Tupac|-|I just don't give a fuck!|-|Talking that shit behind my back, dirty mackin|-|Telling your boys that I'm on crack|-|I just don't give a fuck!|-|So put my tape back on the rack|-|Go run and tell your friends my shit is wack|-|I just don't give a fuck!|-|But see me on the street and duck|-|'Cause you gon' get stuck, stoned and snuffed|-|'Cause I just don't give a fuck!|-||-|I'm nicer than Pete, but I'm on a Search to crush a Milkbone|-|I'm everlasting, I melt Vanilla Ice like silicone|-|I'm ill enough to just straight up diss you for no reason|-|I'm colder than snow season when it's twenty below freezing|-|Flavor with no seasoning, this is the sneak preview|-|I'll diss your magazine and still won't get a weak review|-|I'll make your freak leave you, smell the Folgers crystals|-|This is a lyrical combat, gentlemen hold your pistols|-|But I form like Voltron and blast you with my shoulder missiles|-|Slim Shady, Eminem was the old initials (Bye-bye!)|-|Extortion, snorting, supporting abortion|-|Pathological liar, blowing shit out of proportion|-|The looniest, zaniest, spontaneous, sporadic|-|Impulsive thinker, compulsive drinker, addict|-|Half animal, half man|-|Dumping your dead body inside of a fucking trash can|-|With more holes than an Afghan|-||-||-|Somebody let me out this limousine (hey, let me out!)|-|I'm a caged demon, on stage screaming like Rage Against The Machine|-|I'm convinced I'm a fiend, shooting up while this record is spinning|-|Clinically brain dead, I don't need a second opinion|-|Fuck dropping the jewel, I'm flipping the sacred treasure|-|I'll bite your motherfucking style, just to make it fresher|-|I can't take the pressure, I'm sick of bitches|-|Sick of nagging bosses bitching while I'm washing dishes|-|In school I never said much, too busy having a headrush|-|Doing too much rush had my face flushed like red blush|-|Then I went to Jim Beam, that's when my face grayed|-|Went to gym in eighth grade, raped the women's swim team|-|Don't take me for a joke I'm no comedian|-|Too many mental problems got me snorting coke and smoking weed again|-|I'm going up over the curb, driving on the median|-|Finally made it home, but I don't got the key to get in|-||-||-|Shit, fuck everything...|-|Outsiders, Pace One, Young Zee.|-|Fuck the entire world...",,,
5,Till I Collapse,"'Cause sometimes you just feel tired, feel weak, and when you feel weak, you feel like you wanna just give up, but you gotta search within you, you gotta find that inner strength and just pull that shit out of you and get that motivation to not give up and not be a quitter, no matter how bad you wanna just fall flat on your face and collapse.|-||-|Yo left, yo left, yo left right left|-|Yo left, yo left, yo left right left|-|Yo left, yo left, yo left right left|-|Yo left, yo left, yo left right left|-||-|'Til I collapse I'm spilling these raps long as you feel 'em|-|'Til the day that I drop you'll never say that I'm not killing them|-|'Cause when I am not then I'm 'a stop pinning 'em|-|And I am not hip-hop and I'm just not Eminem.|-||-|Subliminal thoughts when I'm 'a stop sending|-|Them women are caught in webs spin and hock venom|-|Adrenaline shots of penicillin could not get the illing to stop.|-|Amoxicillin is just not real enough.|-||-|The criminal cop killing hip-hop filling a minimal swap to cop millions of Pac listeners.|-|You're coming with me, feel it or not you're gonna fear it like I showed you the spirit of God lives in us.|-||-|You hear it a lot, lyrics that shock is it a miracle or am I just a product of pop fizzing up.|-|For shizzel my wizzel this is the plot listen up you bizzels forgot slizzel does not give a fuck.|-||-|'Til the roof comes off, 'til the lights go out|-|'Til my legs give out, can't shut my mouth.|-|'Til the smoke clears out. Am I high? Perhaps|-|I'm 'a rip this shit 'til my bones collapse.|-||-|'Til the roof comes off, 'til the lights go out|-|'Til my legs give out, can't shut my mouth.|-|'Til the smoke clears out. Am I high? Perhaps|-|I'm 'a rip this shit 'til my bones collapse.|-||-|Music is like magic there's a certain feeling you get when you're real|-|And you spit and people are feeling your shit.|-|This is your moment and every single minute you spend trying to hold onto it|-|'Cause you may never get it again.|-||-|So while you're in it try to get as much shit as you can|-|And when your run is over just admit when it's at its end.|-|'Cause I'm at the end of my wits with half this shit that gets in.|-|I got a list here's the order of my list that it's in.|-||-|It goes Reggie, Jay-Z, Tupac and Biggie, Andre from OutKast, Jada, Kurupt, Nas and then me.|-|But in this industry I'm the cause of a lot of envy, so when I'm not put on this list the shit does not offend me.|-||-|That's why you see me walk around like nothing's bothering me.|-|Even though half you people got a fucking problem with me.|-|You hate it but you know respect you've got to give me|-|The press's wet dream like Bobby and Whitney. Nate, hit me.|-||-|'Til the roof comes off, 'til the lights go out|-|'Til my legs give out, can't shut my mouth.|-|'Til the smoke clears out. Am I high? Perhaps|-|I'm 'a rip this shit 'til my bones collapse.|-||-|'Til the roof comes off, 'til the lights go out|-|'Til my legs give out, can't shut my mouth.|-|'Til the smoke clears out. Am I high? Perhaps|-|I'm 'a rip this shit 'til my bones collapse.|-||-|Soon as a verse starts I eat it at MC's heart|-|What is he thinking? How not to go against me? Smart.|-|And it's absurd how people hang on every word.|-|I'll probably never get the props I feel I ever deserve|-||-|But I'll never be served my spot is forever reserved|-|If I ever leave earth that would be the death of me first.|-|'Cause in my heart of hearts I know nothing could ever be worse.|-|That's why I'm clever when I put together every verse|-||-|My thoughts are sporadic, I act like I'm an addict|-|I rap like I'm addicted to smack like I'm Kim Mathers.|-|But I don't want to go forth and back in constant battles|-|The fact is I would rather sit back and bomb some rappers.|-||-|So this is like a full-blown attack I'm launching at them|-|The track is on some battling raps who want some static|-|'Cause I don't really think that the fact that I'm Slim matters|-|A plaque of platinum status is whack if I'm not the baddest. So...|-||-|'Til the roof comes off, 'til the lights go out|-|'Til my legs give out, can't shut my mouth.|-|'Til the smoke clears out. Am I high? Perhaps|-|I'm 'a rip this shit 'til my bones collapse.|-||-|'Til the roof comes off, 'til the lights go out|-|'Til my legs give out, can't shut my mouth.|-|'Til the smoke clears out. Am I high? Perhaps|-|I'm 'a rip this shit 'til my bones collapse.|-||-|Until the roof|-|The roof comes off|-|Until my legs|-|Give out from underneath me|-||-|I will not fall,|-|I will stand tall,|-|Feels like no one can beat me.",,,
