sno,song,lyrics,album,Unnamed: 4,Unnamed: 5
6,Kill You,"When I was just a little baby boy,|-|My momma used to tell me these crazy things|-|She used to tell me my daddy was an evil man,|-|She used to tell me he hated me|-||-|But then I got a little bit older|-|And I realized, she was the crazy one|-|But there was nothing I could do or say to try to change it|-|'Cause that's just the way she was|-||-|They said I can't rap about being broke no more|-|They ain't say I can't rap about coke no more|-|Slut, you think I won't choke no whore|-|'Til the vocal cords don't work in her throat no more?!|-||-|These motherfuckers are thinking I'm playing|-|Thinking I'm saying the shit 'cause I'm thinking it just to be saying it|-|Put your hands down bitch, I ain't gon' shoot you|-|I'mma pull you to this bullet, and put it through you|-||-|Shut up slut, you're causing too much chaos|-|Just bend over and take it like a slut, OK Ma?|-|""Oh, now he's raping his own mother,|-|Abusing a whore, snorting coke, and we gave him the Rolling Stone cover?""|-||-|You're goddamn right bitch, and now it's too late|-|I'm triple platinum and tragedies happen in two states|-|I invented violence, you vile venomous volatile bitches|-|Vain Vicodin, vrinn vrinn, vrinnn!|-||-|Texas Chainsaw, left his brains all|-|Dangling from his neck, while his head barely hangs on|-|Blood, guts, guns, cuts|-|Knives, lives, wives, nuns, sluts|-||-|Bitch I'mma kill you! You don't wanna fuck with me|-|Girls neither - you ain't nothing but a slut to me|-|Bitch I'mma kill you! You ain't got the balls to beef|-|We ain't gon' never stop beefing I don't squash the beef|-||-|You better kill me! I'mma be another rapper dead|-|For popping off at the mouth with shit I shouldn't have said|-|But when they kill me - I'm bringing the world with me|-|Bitches too! You ain't nothing but a girl to me|-||-|I said you don't wanna fuck with Shady ('cause why?)|-|'Cause Shady will fucking kill you|-|I said you don't wanna fuck with Shady (why?)|-|'Cause Shady will fucking kill you|-||-|Bitch I'mma kill you!|-|Like a murder weapon, I'mma conceal you|-|In a closet with mildew, sheets, pillows and film you|-|Fuck with me, I been through hell, shut the hell up!|-|I'm tryna develop these pictures of the Devil to sell 'em|-||-|I ain't ""acid rap"", but I rap on acid|-|Got a new blow-up doll and just had a strap-on added|-|Whoops! Is that a subliminal hint? No!|-|Just criminal intent to sodomize women again|-|Eminem offend? No! Eminem'll insult|-|And if you ever give in to him, you give him an impulse|-|To do it again, then, if he does it again|-|You'll probably end up jumping out of something up on the 10th|-||-|Bitch I'mma kill you, I ain't done this ain't the chorus|-|I ain't even drug you in the woods yet to paint the forest|-|A bloodstain is orange after you wash it three or four times in a tub|-|But that's normal ain't it Norman?|-||-|Serial killer hiding murder material|-|In a cereal box on top of your stereo|-|Here we go again, we're out of our medicine|-|Out of our minds, and we want in yours, let us in|-||-|Or I'mma kill you! You don't wanna fuck with me|-|Girls neither - you ain't nothing but a slut to me|-|Bitch I'mma kill you! You ain't got the balls to beef|-|We ain't gon' never stop beefing I don't squash the beef|-||-|You better kill me! I'mma be another rapper dead|-|For popping off at the mouth with shit I shouldn't have said|-|But when they kill me I'm bringing the world with me|-|Bitches too! You ain't nothing but a girl to me|-||-|I said you don't wanna fuck with Shady ('cause why?)|-|'Cause Shady will fucking kill you|-|I said you don't wanna fuck with Shady (why?)|-|'Cause Shady will fucking kill you|-||-|Eh-heh, know why I say these things?|-|'Cause ladies' screams keep creeping in Shady's dreams|-|And the way things seem, I shouldn't have to pay these shrinks|-|This eighty Gs a week to say the same things tweece!|-||-|Twice? Whatever, I hate these things|-|Fuck shots! I hope the weed'll outweigh these drinks|-|Motherfuckers want me to come on their radio shows|-|Just to argue with 'em cause their ratings stink?|-||-|Fuck that! I'll choke radio announcer to bouncer|-|From fat bitch to all seventy-thousand pounds of her|-|From principal to the student body and counselor|-|From in-school to before school to out of school|-||-|I don't even believe in breathing|-|I'm leaving air in your lungs|-|Just to hear you keep screaming for me to seep it|-|OK, I'm ready to go play|-|I got the machete from O.J.|-|I'm ready to make everyone's throats ache|-||-|You faggots keep egging me on|-|'Til I have you at knifepoint, then you beg me to stop?|-|Shut up! Give me your hands and feet|-|I said shut up when I'm talking to you|-|You hear me? Answer me!|-||-|Or I'mma kill you! You don't wanna fuck with me|-|Girls neither - you ain't nothing but a slut to me|-|Bitch I'mma kill you! You don't got the balls to beef|-|We ain't gon' never stop beefing I don't squash the beef|-||-|You better kill me! I'mma be another rapper dead|-|For popping off at the mouth with shit I shouldn't have said|-|But when they kill me - I'm bringing the world with me|-|Bitches too! You ain't nothing but a girl to me|-|Bitch I'mma kill you!|-||-|You don't wanna fuck with Shady ('cause why?)|-|'Cause Shady will fucking kill you|-|I said you don't wanna fuck with Shady (why not?)|-|'Cause Shady will fucking kill you..|-||-|I'm just playing, ladies|-|You know I love you",,,
7,The Real Slim Shady,"May I have your attention please?|-|May I have your attention please?|-|Will the real Slim Shady please stand up?|-|I repeat, will the real Slim Shady please stand up?|-|We're gonna have a problem here..|-||-|Y'all act like you never seen a white person before|-|Jaws all on the floor like Pam and Tommy just burst in the door|-|And started whooping her ass worse than before|-|They first were divorced, throwing her over furniture (Ah!)|-|It's the return of the... ""Ah, wait, no way, you're kidding,|-|He didn't just say what I think he did, did he?""|-|And Dr. Dre said... nothing, you idiots!|-|Dr. Dre's dead, he's locked in my basement! (Ha-ha!)|-|Feminist women love Eminem|-|""Slim Shady, I'm sick of him|-|Look at him, walking around grabbing his you-know-what|-|Flipping the you-know-who."" ""Yeah, but he's so cute though!""|-|Yeah, I probably got a couple of screws up in my head loose|-|But no worse, than what's going on in your parents' bedrooms|-|Sometimes, I wanna get on TV and just let loose, but can't|-|But it's cool for Tom Green to hump a dead moose|-|""My bum is on your lips, my bum is on your lips""|-|And if I'm lucky, you might just give it a little kiss|-|And that's the message that we deliver to little kids|-|And expect them not to know what a woman's clitoris is|-|Of course they gonna know what intercourse is|-|By the time they hit fourth grade|-|They got the Discovery Channel, don't they?|-|""We ain't nothing but mammals.."" Well, some of us cannibals|-|Who cut other people open like cantaloupes But if we can hump dead animals and antelopes|-|Then there's no reason that a man and another man can't elope|-|[*EWWW!*] But if you feel like I feel, I got the antidote|-|Women wave your pantyhose, sing the chorus and it goes|-||-|'Cause I'm Slim Shady, yes I'm the real Shady|-|All you other Slim Shadys are just imitating|-|So won't the real Slim Shady please stand up,|-|Please stand up, please stand up?|-||-|Will Smith don't gotta cuss in his raps to sell records;|-|Well I do, so fuck him and fuck you too!|-|You think I give a damn about a Grammy?|-|Half of you critics can't even stomach me, let alone stand me|-|""But Slim, what if you win, wouldn't it be weird?""|-|Why? So you guys could just lie to get me here?|-|So you can, sit me here next to Britney Spears?|-|Yo Shit, Christina Aguilera better switch me chairs|-|So I can sit next to Carson Daly and Fred Durst|-|And hear 'em argue over who she gave head to first|-|Little bitch, put me on blast on MTV|-|""Yeah, he's cute, but I think he's married to Kim, hee-hee!""|-|I should download her audio on MP3|-|And show the whole world how you gave Eminem VD I'm sick of you little girl and boy groups, all you do is annoy me|-|So I have been sent here to destroy you And there's a million of us just like me|-|Who cuss like me; who just don't give a fuck like me|-|Who dress like me; walk, talk and act like me|-|It just might be the next best thing but not quite me!|-||-||-|I'm like a head trip to listen to, cause I'm only giving you|-|Things you joke about with your friends inside your living room|-|The only difference is I got the balls to say it|-|In front of y'all and I don't gotta be false or sugarcoated at all|-|I just get on the mic and spit it|-|And whether you like to admit it [*ERR*] I just shit it|-|Better than ninety percent of you rappers out can|-|Then you wonder how can kids eat up these albums like Valiums|-|It's funny; 'cause at the rate I'm going when I'm thirty|-|I'll be the only person in the nursing home flirting|-|Pinching nurses asses when I'm jacking off with Jergens|-|And I'm jerking but this whole bag of Viagra isn't working|-|And every single person is a Slim Shady lurking|-|He could be working at Burger King, spitting on your onion rings|-|[*HACH*] Or in the parking lot, circling|-|Screaming ""I don't give a fuck!""|-|With his windows down and his system up|-|So, will the real Shady please stand up?|-|And put one of those fingers on each hand up?|-|And be proud to be outta your mind and outta control|-|And one more time, loud as you can, how does it go?|-||-||-|Ha ha|-|Guess there's a Slim Shady in all of us|-|Fuck it, let's all stand up",,,
8,My Name Is,"Hi, my name is, what? My name is, who?|-|My name is, chka-chka, Slim Shady|-|Hi, my name is, huh? My name is, what?|-|My name is, chka-chka, Slim Shady|-|Hi, my name is, what? (Excuse me) My name is, who?|-|My name is, chka-chka, Slim Shady|-|(Can I have the attention of the class for one second?)|-|Hi, my name is, huh? My name is, what?|-|My name is, chka-chka, Slim Shady|-||-|Hi, kids, do you like violence? (Yeah, yeah, yeah)|-|Wanna see me stick Nine Inch Nails through each one of my eyelids? (Uh-huh)|-|Wanna copy me and do exactly like I did? (Yeah, yeah)|-|Try 'cid and get fucked up worse than my life is? (Huh?)|-|My brain's dead weight, I'm tryna get my head straight|-|But I can't figure out which Spice Girl I want to impregnate (Oh)|-|And Dr. Dre said, ""Slim Shady, you a basehead"" (Uh-uh)|-|""Then why's your face red? Man, you wasted""|-|Well, since age twelve, I felt like I'm someone else|-|'Cause I hung my original self from the top bunk with a belt|-|Got pissed off and ripped Pamela Lee's tits off|-|And smacked her so hard I knocked her clothes backwards like Kris Kross|-|I smoke a fat pound of grass, and fall on my ass|-|Faster than a fat bitch who sat down too fast|-|Come here, slut; ""Shady, wait a minute, that's my girl, dawg""|-|I don't give a fuck, God sent me to piss the world off|-||-|Hi, my name is, what? My name is, who?|-|My name is, chka-chka, Slim Shady|-|Hi, my name is, huh? My name is, what?|-|My name is, chka-chka, Slim Shady|-|Hi, my name is, what? My name is, who?|-|My name is, chka-chka, Slim Shady|-|Hi, my name is, huh? My name is, what?|-|My name is, chka-chka, Slim Shady|-||-|My English teacher wanted to flunk me in junior high (Shh)|-|Thanks a lot, next semester I'll be thirty-five|-|I smacked him in his face with an eraser, chased him with a stapler|-|And stapled his nuts to a stack of paper (Owwwwwwww!)|-|Walked in the strip club, had my jacket zipped up|-|Flashed the bartender, then stuck my dick in the tip cup|-|Extraterrestrial, running over pedestrians in a spaceship|-|While they're screaming at me, ""Let's just be friends""|-|Ninety-nine percent of my life, I was lied to|-|I just found out my mom does more dope than I do (Damn)|-|I told her I'd grow up to be a famous rapper|-|Make a record about doing drugs and name it after her|-|(Oh, thank you)|-|You know you blew up when the women rush your stands|-|And try to touch your hands like some screaming Usher fans|-|(Ahh, ahh, ahh)|-|This guy at White Castle asked for my autograph (Dude, can I get your autograph?)|-|So I signed it, ""Dear Dave, thanks for the support, asshole""|-||-|Hi, my name is, huh? My name is, who?|-|My name is, chka-chka, Slim Shady|-|Hi, my name is, what? My name is, who?|-|My name is, chka-chka, Slim Shady|-|Hi, my name is, huh? My name is, who?|-|My name is, chka-chka, Slim Shady|-|Hi, my name is, what? My name is, who?|-|My name is, chka-chka, Slim Shady|-||-|Stop the tape, this kid needs to be locked away (Get him)|-|Dr. Dre, don't just stand there, operate|-|I'm not ready to leave, it's too scary to die (Fuck that)|-|I'll have to be carried inside the cemetery and buried alive|-|(Huh, yup)|-|Am I coming or going? I can barely decide|-|I just drank a fifth of vodka, dare me to drive? (Go ahead)|-|All my life I was very deprived|-|I ain't had a woman in years and my palms are too hairy to hide (Whoops)|-|Clothes ripped like the Incredible Hulk|-|I spit when I talk, I'll fuck anything that walks (Come here)|-|When I was little, I used to get so hungry I would throw fits|-|How you gonna breastfeed me, Mom? You ain't got no tits|-|I lay awake and strap myself in the bed|-|With a bulletproof vest on and shoot myself in the head (Bang)|-|'Cause I'm steaming mad (Grr)|-|And by the way, when you see my dad (Yeah?)|-|Tell him that I slit his throat in this dream I had|-||-|Hi, my name is, what? My name is, who?|-|My name is, chka-chka, Slim Shady|-|Hi, my name is, huh? My name is, what?|-|My name is, chka-chka, Slim Shady|-|Hi, my name is, who? My name is, huh?|-|My name is, chka-chka, Slim Shady|-|Hi, my name is, huh? My name is, who?|-|My name is, chka-chka, Slim Shady",,,
9,Not Afraid,"I'm not afraid (I'm not afraid)|-|To take a stand (to take a stand)|-|Everybody (everybody)|-|Come take my hand (come take my hand)|-|We'll walk this road together, through the storm|-|Whatever weather, cold or warm|-|Just letting you know that you're not alone|-|Holler if you feel like you've been down the same road (same road)|-||-|Yeah, it's been a ride|-|I guess I had to, go to that place, to get to this one|-|Now some of you, might still be in that place|-|If you're trying to get out, just follow me|-|I'll get you there|-||-|You can try and read my lyrics off of this paper before I lay 'em|-|But you won't take the sting out these words before I say 'em|-|'Cause ain't no way I'mma let you stop me from causing mayhem|-|When I say I'mma do something I do it|-|I don't give a damn what you think|-|I'm doing this for me, so fuck the world|-|Feed it beans, it's gassed up, if it thinks it's stopping me|-|I'mma be what I set out to be, without a doubt undoubtedly|-|And all those who look down on me I'm tearing down your balcony|-|No ifs, ands or buts, don't try to ask him why or how can he|-|From ""Infinite"" down to the last ""Relapse"" album|-|He's still shitting, whether he's on salary paid hourly|-|Until he bows out or he shits his bowels out of him|-|Whichever comes first, for better or worse|-|He's married to the game, like a ""fuck you"" for Christmas|-|His gift is a curse, forget the Earth, he's got the urge|-|To pull his dick from the dirt, and fuck the whole universe|-||-|I'm not afraid (I'm not afraid)|-|To take a stand (to take a stand)|-|Everybody (everybody)|-|Come take my hand (come take my hand)|-|We'll walk this road together, through the storm|-|Whatever weather, cold or warm|-|Just letting you know that you're not alone|-|Holler if you feel like you've been down the same road (same road)|-||-|Okay quit playing with the scissors and shit, and cut the crap|-|I shouldn't have to rhyme these words in a rhythm for you to know it's a rap|-|You said you was king, you lied through your teeth|-|For that fuck your feelings|-|Instead of getting crowned you're getting capped|-|And to the fans, I'll never let you down again, I'm back|-|I promise to never go back on that promise|-|In fact let's be honest|-|That last ""Relapse"" CD was ""ehh""|-|Perhaps I ran them accents into the ground|-|Relax, I ain't going back to that now|-|All I'm trying to say is get back, click-clack, blow|-|'Cause I ain't playing around|-|There's a game called circle and I don't know how, I'm way too up to back down|-|But I think I'm still trying to figure this crap out|-|Thought I had it mapped out but I guess I didn't, this fucking black cloud|-|Still follows me around but it's time to exorcise these demons|-|These motherfuckers are doing jumping jacks now!|-||-|I'm not afraid (I'm not afraid)|-|To take a stand (to take a stand)|-|Everybody (everybody)|-|Come take my hand (come take my hand)|-|We'll walk this road together, through the storm|-|Whatever weather, cold or warm|-|Just letting you know that you're not alone|-|Holler if you feel like you've been down the same road (same road)|-||-|And I just can't keep living this way|-|So starting today, I'm breaking out of this cage|-|I'm standing up, I'mma face my demons|-|I'm manning up, I'mma hold my ground|-|I've had enough, now I'm so fed up|-|Time to put my life back together right now! (now)|-||-|It was my decision to get clean, I did it for me|-|Admittedly, I probably did it subliminally|-|For you, so I could come back a brand-new me you helped see me through|-|And don't even realize what you did, 'cause believe me you|-|I've been through the wringer, but they could do little to the middle finger|-|I think I got a tear in my eye, I feel like the king of|-|My world, haters can make like bees with no stingers|-|And drop dead, no more beef lingers|-|No more drama from now on, I wanna promise|-|To focus solely on handling my responsibilities as a father|-|So I solemnly swear to always treat this roof, like my daughters|-|And raise it, you couldn't lift a single shingle on it!|-|'Cause the way I feel, I'm strong enough to go to the club|-|Or the corner pub, and lift the whole liquor counter up|-|'Cause I'm raising the bar|-|I'd shoot for the moon but I'm too busy gazing at stars|-|I feel amazing and I'm...|-||-|I'm not afraid (I'm not afraid)|-|To take a stand (to take a stand)|-|Everybody (everybody)|-|Come take my hand (come take my hand)|-|We'll walk this road together, through the storm|-|Whatever weather, cold or warm|-|Just letting you know that you're not alone|-|Holler if you feel like you've been down the same road (same road)",,,
10,Space Bound,"We touch I feel a rush|-|We clutch it isn't much|-|But it's enough to make me wonder what's in store for us|-|It's lust, it's torturous|-|You must be a sorceress 'cause you just|-|Did the impossible|-|Gained my trust don't play games it'll be dangerous|-|If you fuck me over|-|'Cause if I get burnt I'mma show you what it's like to hurt|-|'Cause I've been treated like dirt before you|-|And love is ""evol""|-|Spell it backwards I'll show you|-||-|Nobody knows me I'm cold|-|Walk down this road all alone|-|It's no one's fault but my own|-|It's the path I've chosen to go|-|Frozen as snow I show no emotion whatsoever so|-|Don't ask me why I have no love for these motherfucking ho's|-|Bloodsucking succubuses, what the fuck is up with this?|-|I've tried in this department but I ain't had no luck with this|-|It sucks but it's exactly what I thought it would be|-|Like trying to start over|-|I got a hole in my heart, but some kind of emotional roller coaster|-|Something I won't go on 'til you toy with my emotions, so it's over|-|It's like an explosion every time I hold you, I wasn't joking when I told you|-|You take my breath away|-|You're a supernova... and I'm a|-||-|I'm a space bound rocket ship and your heart's the moon|-|And I'm aiming right at you|-|Right at you|-|Two hundred fifty thousand miles on a clear night in June|-|And I'm aiming right at you|-|Right at you|-|Right at you|-||-|I'll do whatever it takes|-|When I'm with you I get the shakes|-|My body aches when I ain't|-|With you I have zero strength|-|There's no limit on how far I would go|-|No boundaries, no lengths|-|Why do we say that until we get that person that we think's|-|Gonna be that one and then once we get 'em it's never the same?|-|You want them when they don't want you|-|Soon as they do feelings change|-|It's not a contest and I ain't on no conquest for no mate|-|I wasn't looking when I stumbled onto you must've been fate|-|But so much is at stake what the fuck does it take|-|Let's cut to the chase|-|'Fore a door shuts in your face|-|Promise me if I cave in and break and leave myself open|-|That I won't be making a mistake|-|Cause I'm a...|-||-|I'm a space bound rocket ship and your heart's the moon|-|And I'm aiming right at you|-|Right at you|-|Two hundred fifty thousand miles on a clear night in June|-|And I'm aiming right at you|-|Right at you|-|Right at you|-||-|So after a year and six months, it's no longer me that you want|-|But I love you so much it hurts|-|Never mistreated you once|-|I poured my heart out to you|-|Let down my guard swear to God|-|I'll blow my brains in your lap|-|Lay here and die in your arms|-|Drop to my knees and I'm pleading|-|I'm trying to stop you from leaving|-|You won't even listen so fuck it|-|I'm trying to stop you from breathing|-|I put both hands on your throat|-|I sit on top of you squeezing|-|'Til I snap your neck like a Popsicle stick|-|Ain't no possible reason I could think of to let you walk up out this house|-|And let you live|-|Tears stream down both of my cheeks|-|Then I let you go and just give|-|And before I put that gun to my temple|-|I told you this|-||-|And I would have did anything for you|-|To show you how much I adored you|-|But it's over now|-|It's too late to save our love|-|Just promise me you'll think of me every time you look up in the sky and see a star 'cause I'm a...|-||-|I'm a space bound rocket ship and your heart's the moon|-|And I'm aiming right at you|-|Right at you|-|Two hundred fifty thousand miles on a clear night in June|-|And I'm so lost without you|-|Without you|-|Without you",,,
